{
  "irVersion": "1.0",
  "workbook": {
    "name": "Midnight Census Dashboard",
    "pascalName": "MidnightCensusDashboard",
    "sourcePath": "Data/Midnight Census/Midnight Census Dashboard.twb",
    "version": "18.1",
    "platform": ""
  },
  "dataSources": [
    {
      "name": "Midnight Census NEW",
      "internalName": "federated.0l4ojaz172oi9916uui6o0yakgnb",
      "connectionClass": "hyper",
      "sourceType": "Hyper",
      "files": [],
      "server": "",
      "database": "C:/Users/AmanRajMAQSoftware/Downloads/Midnight_Census_Template.hyper",
      "schema": "Extract",
      "tables": [
        "Custom SQL Query",
        "Extract].[Extract"
      ],
      "active": false
    },
    {
      "name": "Midnight_Census_Template",
      "internalName": "federated.09go31s1b3pn2k1ezewf3027s71v",
      "connectionClass": "textscan",
      "sourceType": "CSV",
      "files": [
        "Midnight_Census_Template.csv",
        "C:/Users/AmanRajMAQSoftware/Downloads/Midnight Census"
      ],
      "server": "",
      "database": null,
      "schema": null,
      "tables": [
        "Midnight_Census_Template#csv"
      ],
      "active": true
    }
  ],
  "columns": [
    {
      "datasource": "Midnight Census NEW",
      "name": "Census Date",
      "caption": null,
      "dataType": "date",
      "role": "dimension",
      "semanticRole": null,
      "format": null,
      "ordinal": 6
    },
    {
      "datasource": "Midnight_Census_Template",
      "name": "DEPARTMENT_KEY",
      "caption": null,
      "dataType": "integer",
      "role": "dimension",
      "semanticRole": null,
      "format": null,
      "ordinal": 0
    },
    {
      "datasource": "Midnight_Census_Template",
      "name": "Encounter CSN",
      "caption": null,
      "dataType": "integer",
      "role": "dimension",
      "semanticRole": null,
      "format": null,
      "ordinal": 1
    },
    {
      "datasource": "Midnight_Census_Template",
      "name": "Parent Hospital",
      "caption": null,
      "dataType": "string",
      "role": "dimension",
      "semanticRole": null,
      "format": null,
      "ordinal": 2
    },
    {
      "datasource": "Midnight_Census_Template",
      "name": "Hospital",
      "caption": null,
      "dataType": "string",
      "role": "dimension",
      "semanticRole": null,
      "format": null,
      "ordinal": 3
    },
    {
      "datasource": "Midnight_Census_Template",
      "name": "Unit",
      "caption": null,
      "dataType": "string",
      "role": "dimension",
      "semanticRole": null,
      "format": null,
      "ordinal": 4
    },
    {
      "datasource": "Midnight_Census_Template",
      "name": "Patient Class",
      "caption": null,
      "dataType": "string",
      "role": "dimension",
      "semanticRole": null,
      "format": null,
      "ordinal": 5
    },
    {
      "datasource": "Midnight_Census_Template",
      "name": "Census Date",
      "caption": null,
      "dataType": "date",
      "role": "dimension",
      "semanticRole": null,
      "format": null,
      "ordinal": 6
    },
    {
      "datasource": "Midnight_Census_Template",
      "name": "Census Count",
      "caption": null,
      "dataType": "integer",
      "role": "dimension",
      "semanticRole": null,
      "format": null,
      "ordinal": 7
    },
    {
      "datasource": "Midnight_Census_Template",
      "name": "Census Count Adults",
      "caption": null,
      "dataType": "integer",
      "role": "dimension",
      "semanticRole": null,
      "format": null,
      "ordinal": 8
    },
    {
      "datasource": "Midnight_Census_Template",
      "name": "Census Count Peds",
      "caption": null,
      "dataType": "integer",
      "role": "dimension",
      "semanticRole": null,
      "format": null,
      "ordinal": 9
    }
  ],
  "calculatedFields": [
    {
      "caption": "Filter Adults/Peds",
      "fieldName": "[End Date (copy)]",
      "dataType": "string",
      "role": "measure",
      "formula": "\"(All)\"",
      "isTableCalc": false,
      "complexity": "trivial",
      "suggestedDaxKind": "measure"
    },
    {
      "caption": "Date Agg Level",
      "fieldName": "[Parameter 1]",
      "dataType": "string",
      "role": "measure",
      "formula": "\"Monthly\"",
      "isTableCalc": false,
      "complexity": "trivial",
      "suggestedDaxKind": "measure"
    },
    {
      "caption": "View",
      "fieldName": "[Parameter 2]",
      "dataType": "string",
      "role": "measure",
      "formula": "\"Bar Chart\"",
      "isTableCalc": false,
      "complexity": "trivial",
      "suggestedDaxKind": "measure"
    },
    {
      "caption": "Start Date",
      "fieldName": "[Parameter 3]",
      "dataType": "date",
      "role": "measure",
      "formula": "#2026-01-01#",
      "isTableCalc": false,
      "complexity": "trivial",
      "suggestedDaxKind": "measure"
    },
    {
      "caption": "End Date",
      "fieldName": "[Start Date (copy)_305681891901829120]",
      "dataType": "date",
      "role": "measure",
      "formula": "#2026-06-09#",
      "isTableCalc": false,
      "complexity": "trivial",
      "suggestedDaxKind": "measure"
    },
    {
      "caption": "User Defined Census Count",
      "fieldName": "[Calculation_2234066952297496576]",
      "dataType": "integer",
      "role": "measure",
      "formula": "CASE [Parameters].[End Date (copy)]\r\n    WHEN '(All)' THEN SUM([Census Count])\r\n    WHEN 'Adults' THEN SUM([Census Count Adults])\r\n    WHEN 'Peds' THEN SUM([Census Count Peds])\r\nEND",
      "isTableCalc": false,
      "complexity": "trivial",
      "suggestedDaxKind": "measure"
    },
    {
      "caption": "Date Range Filter",
      "fieldName": "[Calculation_2234066952299909123]",
      "dataType": "boolean",
      "role": "dimension",
      "formula": "[Census Date] >= [Parameters].[Parameter 3] AND [Census Date] <= [Parameters].[Start Date (copy)_305681891901829120]",
      "isTableCalc": false,
      "complexity": "trivial",
      "suggestedDaxKind": "column"
    },
    {
      "caption": "Start Month Contains Partial Data?",
      "fieldName": "[Calculation_2234066952300421124]",
      "dataType": "integer",
      "role": "measure",
      "formula": "IF\r\nYEAR(MAX([Census Date])) = YEAR(MAX([Parameters].[Parameter 3]))\r\nAND MONTH(MAX([Census Date])) = MONTH(MAX([Parameters].[Parameter 3]))\r\nAND MIN([Parameters].[Parameter 3]) <> DATE(STR(YEAR(WINDOW_MIN(MIN([Census Date]))))+'-'+STR(MONTH(WINDOW_MIN(MIN([Census Date]))))+'-01')\r\nTHEN 1 ELSE 0 END",
      "isTableCalc": true,
      "complexity": "complex",
      "suggestedDaxKind": "measure"
    },
    {
      "caption": "End Month Contains Partial Data?",
      "fieldName": "[Calculation_2234066952300756997]",
      "dataType": "integer",
      "role": "measure",
      "formula": "IF MONTH(MAX([Parameters].[Start Date (copy)_305681891901829120])) = 12 THEN\r\n    IF YEAR(MAX([Census Date])) = YEAR(MAX([Parameters].[Start Date (copy)_305681891901829120]))\r\n    AND MONTH(MAX([Census Date])) = MONTH(MAX([Parameters].[Start Date (copy)_305681891901829120]))\r\n    AND MAX([Parameters].[Start Date (copy)_305681891901829120]) <> DATEADD('day', -1, DATE(STR(YEAR(WINDOW_MAX(MAX([Census Date])))+1)+'-'+STR(MONTH(DATEADD('month', 1, WINDOW_MAX(MAX([Census Date])))))+'-01'))\r\n    THEN 1 ELSE 0 END\r\nELSEIF YEAR(MAX([Census Date])) = YEAR(MAX([Parameters].[Start Date (copy)_305681891901829120]))\r\n    AND MONTH(MAX([Census Date])) = MONTH(MAX([Parameters].[Start Date (copy)_305681891901829120]))\r\n    AND MAX([Parameters].[Start Date (copy)_305681891901829120]) <> DATEADD('day', -1, DATE(STR(YEAR(WINDOW_MAX(MAX([Census Date]))))+'-'+STR(MONTH(DATEADD('month', 1, WINDOW_MAX(MAX([Census Date])))))+'-01'))\r\n    THEN 1 ELSE 0 \r\nEND",
      "isTableCalc": true,
      "complexity": "complex",
      "suggestedDaxKind": "measure"
    },
    {
      "caption": "Default Start Date",
      "fieldName": "[Calculation_2234066952304320524]",
      "dataType": "date",
      "role": "dimension",
      "formula": "IF MONTH(TODAY()) >= 7 OR MONTH(TODAY()) <= 9 \r\nTHEN DATE(STR(YEAR(TODAY())) + '-01-01')\r\nELSE\r\n    IF MONTH(TODAY()) < 7 THEN\r\n        DATE(STR(YEAR(TODAY())-1) + '-07-01')\r\n    ELSE DATE(STR(YEAR(TODAY())) + '-07-01')\r\n    END\r\nEND",
      "isTableCalc": false,
      "complexity": "trivial",
      "suggestedDaxKind": "column"
    },
    {
      "caption": "Default End Date",
      "fieldName": "[Calculation_2234066952304459789]",
      "dataType": "date",
      "role": "dimension",
      "formula": "TODAY()-1",
      "isTableCalc": false,
      "complexity": "trivial",
      "suggestedDaxKind": "column"
    },
    {
      "caption": "Date agg_Monthly",
      "fieldName": "[Calculation_2234066952309055503]",
      "dataType": "string",
      "role": "dimension",
      "formula": "CASE [Parameters].[Parameter 1]\r\n    WHEN 'Monthly' THEN 'Include'\r\n    ELSE 'Exclude'\r\nEND",
      "isTableCalc": false,
      "complexity": "trivial",
      "suggestedDaxKind": "column"
    },
    {
      "caption": "Partial Months in View?",
      "fieldName": "[Calculation_2234066952314589212]",
      "dataType": "string",
      "role": "dimension",
      "formula": "IF DAY([Parameters].[Parameter 3]) != 1\r\n    OR DAY(DATEADD('day',1,[Parameters].[Start Date (copy)_305681891901829120])) != 1\r\nTHEN \"**Partial months are displayed in GRAY**\" ELSE \"\" END",
      "isTableCalc": false,
      "complexity": "trivial",
      "suggestedDaxKind": "column"
    },
    {
      "caption": "View_BarChart",
      "fieldName": "[Calculation_2234066952316727326]",
      "dataType": "string",
      "role": "dimension",
      "formula": "CASE [Parameters].[Parameter 2]\r\n    WHEN 'Bar Chart' THEN 'Include'\r\n    ELSE 'Exclude' \r\nEND",
      "isTableCalc": false,
      "complexity": "trivial",
      "suggestedDaxKind": "column"
    },
    {
      "caption": "Census Date_CY",